{
  "run_id": "run_0060",
  "framework": "custom",
  "model": "mock-large",
  "task": "What is the combined population of Egypt, Brazil and France in millions?",
  "outcome": "fail",
  "faulty_step": 1,
  "steps": [
    {
      "step_no": 1,
      "actor": "planner",
      "kind": "decision",
      "input": "### PLAN\nYou are a research agent with two tools:\n- search(query): looks up one fact, e.g. \"population of France\"\n- calculator(expression): evaluates arithmetic, e.g. \"12.5+3\"\n\nTask: What is the combined population of Egypt, Brazil and France in millions?\n\nMake a plan. Search for each fact you need (one search per fact, in the order the task\nmentions them), then give ONE arithmetic expression that combines the facts, using\n{0}, {1}, ... as placeholders for the numbers found by search 0, search 1, ...\nReply with JSON only, for example:\n{\"steps\": [{\"tool\": \"search\", \"query\": \"height of Mont Blanc\"}, {\"tool\": \"search\", \"query\": \"height of Ben Nevis\"}], \"expression\": \"{0}-{1}\"}\n",
      "output": "{\"steps\": [{\"tool\": \"calculator\", \"query\": \"Egypt total population\"}, {\"tool\": \"search\", \"query\": \"Brazil total population\"}, {\"tool\": \"search\", \"query\": \"France total population\"}], \"expression\": \"{0}+{1}+{2}\"}",
      "depends_on": [],
      "error": null,
      "tokens": 221
    },
    {
      "step_no": 2,
      "actor": "calculator",
      "kind": "tool_call",
      "input": "Egypt total population",
      "output": "ERROR: invalid_expression",
      "depends_on": [
        1
      ],
      "error": "invalid_expression",
      "tokens": 0
    },
    {
      "step_no": 3,
      "actor": "reader",
      "kind": "model_call",
      "input": "### READ\nExtract the single number that answers the question from the text.\nReply with the number only (no units, no words). If there is no number, reply: unknown\n\nQuestion: Egypt total population\nText: ERROR: invalid_expression\n",
      "output": "unknown",
      "depends_on": [
        2
      ],
      "error": null,
      "tokens": 58
    },
    {
      "step_no": 4,
      "actor": "search_agent",
      "kind": "tool_call",
      "input": "Brazil total population",
      "output": "Brazil has a population of 216.4 million people.",
      "depends_on": [
        1
      ],
      "error": null,
      "tokens": 0
    },
    {
      "step_no": 5,
      "actor": "reader",
      "kind": "model_call",
      "input": "### READ\nExtract the single number that answers the question from the text.\nReply with the number only (no units, no words). If there is no number, reply: unknown\n\nQuestion: Brazil total population\nText: Brazil has a population of 216.4 million people.\n",
      "output": "216.4",
      "depends_on": [
        4
      ],
      "error": null,
      "tokens": 64
    },
    {
      "step_no": 6,
      "actor": "search_agent",
      "kind": "tool_call",
      "input": "France total population",
      "output": "France has a population of 68.2 million people.",
      "depends_on": [
        1
      ],
      "error": null,
      "tokens": 0
    },
    {
      "step_no": 7,
      "actor": "reader",
      "kind": "model_call",
      "input": "### READ\nExtract the single number that answers the question from the text.\nReply with the number only (no units, no words). If there is no number, reply: unknown\n\nQuestion: France total population\nText: France has a population of 68.2 million people.\n",
      "output": "68.2",
      "depends_on": [
        6
      ],
      "error": null,
      "tokens": 64
    },
    {
      "step_no": 8,
      "actor": "answerer",
      "kind": "model_call",
      "input": "### ANSWER\nTask: What is the combined population of Egypt, Brazil and France in millions?\nCalculation result: unavailable\n\nWrite the final answer as: Final answer: <number>\n",
      "output": "Final answer: unknown",
      "depends_on": [
        3,
        5,
        7
      ],
      "error": null,
      "tokens": 48
    }
  ],
  "task_id": "t10",
  "final_answer": "Final answer: unknown",
  "created_at": "2026-10-03T16:13:56+00:00",
  "fault": {
    "step_no": 1,
    "type": "wrong_tool",
    "seed": 9577,
    "applied": true
  }
}