{
  "run_id": "run_0094",
  "framework": "custom",
  "model": "mock-large",
  "task": "How many times larger is the area of Brazil than the area of Italy? Round to 1 decimal place.",
  "outcome": "fail",
  "faulty_step": 3,
  "steps": [
    {
      "step_no": 1,
      "actor": "planner",
      "kind": "decision",
      "input": "### PLAN\nYou are a research agent with two tools:\n- search(query): looks up one fact, e.g. \"population of France\"\n- calculator(expression): evaluates arithmetic, e.g. \"12.5+3\"\n\nTask: How many times larger is the area of Brazil than the area of Italy? Round to 1 decimal place.\n\nMake a plan. Search for each fact you need (one search per fact, in the order the task\nmentions them), then give ONE arithmetic expression that combines the facts, using\n{0}, {1}, ... as placeholders for the numbers found by search 0, search 1, ...\nReply with JSON only, for example:\n{\"steps\": [{\"tool\": \"search\", \"query\": \"height of Mont Blanc\"}, {\"tool\": \"search\", \"query\": \"height of Ben Nevis\"}], \"expression\": \"{0}-{1}\"}\n",
      "output": "{\"steps\": [{\"tool\": \"search\", \"query\": \"Brazil total area\"}, {\"tool\": \"search\", \"query\": \"Italy total area\"}], \"expression\": \"{0}/{1}\"}",
      "depends_on": [],
      "error": null,
      "tokens": 209
    },
    {
      "step_no": 2,
      "actor": "search_agent",
      "kind": "tool_call",
      "input": "Brazil total area",
      "output": "Brazil covers a total area of 8516 thousand square kilometers.",
      "depends_on": [
        1
      ],
      "error": null,
      "tokens": 0
    },
    {
      "step_no": 3,
      "actor": "reader",
      "kind": "model_call",
      "input": "### READ\nExtract the single number that answers the question from the text.\nReply with the number only (no units, no words). If there is no number, reply: unknown\n\nQuestion: Brazil total area\nText: Brazil covers a total area of 8516 thousand square kilometers.\n",
      "output": "11666.92",
      "depends_on": [
        2
      ],
      "error": null,
      "tokens": 66
    },
    {
      "step_no": 4,
      "actor": "search_agent",
      "kind": "tool_call",
      "input": "Italy total area",
      "output": "Italy covers a total area of 301.3 thousand square kilometers.",
      "depends_on": [
        1
      ],
      "error": null,
      "tokens": 0
    },
    {
      "step_no": 5,
      "actor": "reader",
      "kind": "model_call",
      "input": "### READ\nExtract the single number that answers the question from the text.\nReply with the number only (no units, no words). If there is no number, reply: unknown\n\nQuestion: Italy total area\nText: Italy covers a total area of 301.3 thousand square kilometers.\n",
      "output": "301.3",
      "depends_on": [
        4
      ],
      "error": null,
      "tokens": 66
    },
    {
      "step_no": 6,
      "actor": "calculator",
      "kind": "tool_call",
      "input": "11666.92/301.3",
      "output": "38.721938",
      "depends_on": [
        1,
        3,
        4,
        5
      ],
      "error": null,
      "tokens": 0
    },
    {
      "step_no": 7,
      "actor": "answerer",
      "kind": "model_call",
      "input": "### ANSWER\nTask: How many times larger is the area of Brazil than the area of Italy? Round to 1 decimal place.\nCalculation result: 38.721938\n\nWrite the final answer as: Final answer: <number>\n",
      "output": "Final answer: 38.7",
      "depends_on": [
        6
      ],
      "error": null,
      "tokens": 52
    }
  ],
  "task_id": "t16",
  "final_answer": "Final answer: 38.7",
  "created_at": "2026-10-03T16:13:56+00:00",
  "fault": {
    "step_no": 3,
    "type": "wrong_number",
    "seed": 949,
    "applied": true
  }
}