{
  "run_id": "run_0216",
  "framework": "custom",
  "model": "mock-small",
  "task": "How many times larger is the area of Japan than the area of Italy? Round to 1 decimal place.",
  "outcome": "fail",
  "faulty_step": 2,
  "steps": [
    {
      "step_no": 1,
      "actor": "planner",
      "kind": "decision",
      "input": "### PLAN\nYou are a research agent with two tools:\n- search(query): looks up one fact, e.g. \"population of France\"\n- calculator(expression): evaluates arithmetic, e.g. \"12.5+3\"\n\nTask: How many times larger is the area of Japan than the area of Italy? Round to 1 decimal place.\n\nMake a plan. Search for each fact you need (one search per fact, in the order the task\nmentions them), then give ONE arithmetic expression that combines the facts, using\n{0}, {1}, ... as placeholders for the numbers found by search 0, search 1, ...\nReply with JSON only, for example:\n{\"steps\": [{\"tool\": \"search\", \"query\": \"height of Mont Blanc\"}, {\"tool\": \"search\", \"query\": \"height of Ben Nevis\"}], \"expression\": \"{0}-{1}\"}\n",
      "output": "{\"steps\": [{\"tool\": \"search\", \"query\": \"area of Japan\"}, {\"tool\": \"search\", \"query\": \"area of Italy\"}], \"expression\": \"{0}/{1}\"}",
      "depends_on": [],
      "error": null,
      "tokens": 207
    },
    {
      "step_no": 2,
      "actor": "search_agent",
      "kind": "tool_call",
      "input": "area of Japan",
      "output": "No results found.",
      "depends_on": [
        1
      ],
      "error": "empty_result",
      "tokens": 0
    },
    {
      "step_no": 3,
      "actor": "reader",
      "kind": "model_call",
      "input": "### READ\nExtract the single number that answers the question from the text.\nReply with the number only (no units, no words). If there is no number, reply: unknown\n\nQuestion: area of Japan\nText: No results found.\n",
      "output": "unknown",
      "depends_on": [
        2
      ],
      "error": null,
      "tokens": 54
    },
    {
      "step_no": 4,
      "actor": "search_agent",
      "kind": "tool_call",
      "input": "area of Italy",
      "output": "Italy covers a total area of 301.3 thousand square kilometers.",
      "depends_on": [
        1
      ],
      "error": null,
      "tokens": 0
    },
    {
      "step_no": 5,
      "actor": "reader",
      "kind": "model_call",
      "input": "### READ\nExtract the single number that answers the question from the text.\nReply with the number only (no units, no words). If there is no number, reply: unknown\n\nQuestion: area of Italy\nText: Italy covers a total area of 301.3 thousand square kilometers.\n",
      "output": "301.3",
      "depends_on": [
        4
      ],
      "error": null,
      "tokens": 65
    },
    {
      "step_no": 6,
      "actor": "answerer",
      "kind": "model_call",
      "input": "### ANSWER\nTask: How many times larger is the area of Japan than the area of Italy? Round to 1 decimal place.\nCalculation result: unavailable\n\nWrite the final answer as: Final answer: <number>\n",
      "output": "Final answer: unknown",
      "depends_on": [
        3,
        5
      ],
      "error": null,
      "tokens": 53
    }
  ],
  "task_id": "t15",
  "final_answer": "Final answer: unknown",
  "created_at": "2026-10-03T16:13:57+00:00",
  "fault": {
    "step_no": 2,
    "type": "empty_search",
    "seed": 6939,
    "applied": true
  }
}