{
  "run_id": "run_0389",
  "framework": "langgraph",
  "model": "mock-large",
  "task": "How many times larger is the area of Turkey than the area of Japan? Round to 1 decimal place.",
  "outcome": "fail",
  "faulty_step": 1,
  "steps": [
    {
      "step_no": 1,
      "actor": "planner",
      "kind": "decision",
      "input": "### PLAN\nYou are a research agent with two tools:\n- search(query): looks up one fact, e.g. \"population of France\"\n- calculator(expression): evaluates arithmetic, e.g. \"12.5+3\"\n\nTask: How many times larger is the area of Turkey than the area of Japan? Round to 1 decimal place.\n\nMake a plan. Search for each fact you need (one search per fact, in the order the task\nmentions them), then give ONE arithmetic expression that combines the facts, using\n{0}, {1}, ... as placeholders for the numbers found by search 0, search 1, ...\nReply with JSON only, for example:\n{\"steps\": [{\"tool\": \"search\", \"query\": \"height of Mont Blanc\"}, {\"tool\": \"search\", \"query\": \"height of Ben Nevis\"}], \"expression\": \"{0}-{1}\"}\n",
      "output": "{\"steps\": [{\"tool\": \"calculator\", \"query\": \"Turkey total area\"}, {\"tool\": \"search\", \"query\": \"Japan total area\"}], \"expression\": \"{0}/{1}\"}",
      "depends_on": [],
      "error": null,
      "tokens": 209
    },
    {
      "step_no": 2,
      "actor": "calculator",
      "kind": "tool_call",
      "input": "Turkey total area",
      "output": "ERROR: invalid_expression",
      "depends_on": [
        1
      ],
      "error": "invalid_expression",
      "tokens": 0
    },
    {
      "step_no": 3,
      "actor": "reader",
      "kind": "model_call",
      "input": "### READ\nExtract the single number that answers the question from the text.\nReply with the number only (no units, no words). If there is no number, reply: unknown\n\nQuestion: Turkey total area\nText: ERROR: invalid_expression\n",
      "output": "unknown",
      "depends_on": [
        2
      ],
      "error": null,
      "tokens": 57
    },
    {
      "step_no": 4,
      "actor": "search_agent",
      "kind": "tool_call",
      "input": "Japan total area",
      "output": "Japan covers a total area of 377.9 thousand square kilometers.",
      "depends_on": [
        1
      ],
      "error": null,
      "tokens": 0
    },
    {
      "step_no": 5,
      "actor": "reader",
      "kind": "model_call",
      "input": "### READ\nExtract the single number that answers the question from the text.\nReply with the number only (no units, no words). If there is no number, reply: unknown\n\nQuestion: Japan total area\nText: Japan covers a total area of 377.9 thousand square kilometers.\n",
      "output": "377.9",
      "depends_on": [
        4
      ],
      "error": null,
      "tokens": 66
    },
    {
      "step_no": 6,
      "actor": "answerer",
      "kind": "model_call",
      "input": "### ANSWER\nTask: How many times larger is the area of Turkey than the area of Japan? Round to 1 decimal place.\nCalculation result: unavailable\n\nWrite the final answer as: Final answer: <number>\n",
      "output": "Final answer: unknown",
      "depends_on": [
        3,
        5
      ],
      "error": null,
      "tokens": 53
    }
  ],
  "task_id": "t18",
  "final_answer": "Final answer: unknown",
  "created_at": "2026-10-03T17:41:35+00:00",
  "fault": {
    "step_no": 1,
    "type": "wrong_tool",
    "seed": 1982,
    "applied": true
  }
}