{
  "run_id": "run_0572",
  "framework": "custom",
  "model": "groq:<model>",
  "task": "What is the combined population of Canada and Turkey in millions?",
  "outcome": "fail",
  "faulty_step": null,
  "steps": [
    {
      "step_no": 1,
      "actor": "planner",
      "kind": "decision",
      "input": "### PLAN\nYou are a research agent with two tools:\n- search(query): looks up one fact, e.g. \"population of France\"\n- calculator(expression): evaluates arithmetic, e.g. \"12.5+3\"\n\nTask: What is the combined population of Canada and Turkey in millions?\n\nMake a plan. Search for each fact you need (one search per fact, in the order the task\nmentions them), then give ONE arithmetic expression that combines the facts, using\n{0}, {1}, ... as placeholders for the numbers found by search 0, search 1, ...\nReply with JSON only, for example:\n{\"steps\": [{\"tool\": \"search\", \"query\": \"height of Mont Blanc\"}, {\"tool\": \"search\", \"query\": \"height of Ben Nevis\"}], \"expression\": \"{0}-{1}\"}\n",
      "output": "",
      "depends_on": [],
      "error": "llm_error: HTTP 404",
      "tokens": 0
    }
  ],
  "task_id": "t05",
  "final_answer": "Final answer: unknown (no valid plan)",
  "created_at": "2026-10-03T19:50:56+00:00"
}