{
  "run_id": "run_0194",
  "framework": "custom",
  "model": "mock-small",
  "task": "How much taller is K2 than Matterhorn, in meters?",
  "outcome": "fail",
  "faulty_step": 5,
  "steps": [
    {
      "step_no": 1,
      "actor": "planner",
      "kind": "decision",
      "input": "### PLAN\nYou are a research agent with two tools:\n- search(query): looks up one fact, e.g. \"population of France\"\n- calculator(expression): evaluates arithmetic, e.g. \"12.5+3\"\n\nTask: How much taller is K2 than Matterhorn, in meters?\n\nMake a plan. Search for each fact you need (one search per fact, in the order the task\nmentions them), then give ONE arithmetic expression that combines the facts, using\n{0}, {1}, ... as placeholders for the numbers found by search 0, search 1, ...\nReply with JSON only, for example:\n{\"steps\": [{\"tool\": \"search\", \"query\": \"height of Mont Blanc\"}, {\"tool\": \"search\", \"query\": \"height of Ben Nevis\"}], \"expression\": \"{0}-{1}\"}\n",
      "output": "{\"steps\": [{\"tool\": \"search\", \"query\": \"height of K2\"}, {\"tool\": \"search\", \"query\": \"height of Matterhorn\"}], \"expression\": \"{0}-{1}\"}",
      "depends_on": [],
      "error": null,
      "tokens": 198
    },
    {
      "step_no": 2,
      "actor": "search_agent",
      "kind": "tool_call",
      "input": "height of K2",
      "output": "K2 is 8611 meters tall.",
      "depends_on": [
        1
      ],
      "error": null,
      "tokens": 0
    },
    {
      "step_no": 3,
      "actor": "reader",
      "kind": "model_call",
      "input": "### READ\nExtract the single number that answers the question from the text.\nReply with the number only (no units, no words). If there is no number, reply: unknown\n\nQuestion: height of K2\nText: K2 is 8611 meters tall.\n",
      "output": "8611",
      "depends_on": [
        2
      ],
      "error": null,
      "tokens": 55
    },
    {
      "step_no": 4,
      "actor": "search_agent",
      "kind": "tool_call",
      "input": "height of Matterhorn",
      "output": "Matterhorn is 4478 meters tall.",
      "depends_on": [
        1
      ],
      "error": null,
      "tokens": 0
    },
    {
      "step_no": 5,
      "actor": "reader",
      "kind": "model_call",
      "input": "### READ\nExtract the single number that answers the question from the text.\nReply with the number only (no units, no words). If there is no number, reply: unknown\n\nQuestion: height of Matterhorn\nText: Matterhorn is 4478 meters tall.\n",
      "output": "3179.38",
      "depends_on": [
        4
      ],
      "error": null,
      "tokens": 59
    },
    {
      "step_no": 6,
      "actor": "calculator",
      "kind": "tool_call",
      "input": "8611-3179.38",
      "output": "5431.62",
      "depends_on": [
        1,
        2,
        3,
        5
      ],
      "error": null,
      "tokens": 0
    },
    {
      "step_no": 7,
      "actor": "answerer",
      "kind": "model_call",
      "input": "### ANSWER\nTask: How much taller is K2 than Matterhorn, in meters?\nCalculation result: 5431.62\n\nWrite the final answer as: Final answer: <number>\n",
      "output": "Final answer: 5431.62",
      "depends_on": [
        6
      ],
      "error": null,
      "tokens": 41
    }
  ],
  "task_id": "t11",
  "final_answer": "Final answer: 5431.62",
  "created_at": "2026-10-03T16:13:57+00:00",
  "fault": {
    "step_no": 5,
    "type": "wrong_number",
    "seed": 2170,
    "applied": true
  }
}