{
  "run_id": "run_0261",
  "framework": "custom",
  "model": "mock-small",
  "task": "What is the average length in kilometers of the Mississippi, Rhine and Nile rivers?",
  "outcome": "fail",
  "faulty_step": 2,
  "steps": [
    {
      "step_no": 1,
      "actor": "planner",
      "kind": "decision",
      "input": "### PLAN\nYou are a research agent with two tools:\n- search(query): looks up one fact, e.g. \"population of France\"\n- calculator(expression): evaluates arithmetic, e.g. \"12.5+3\"\n\nTask: What is the average length in kilometers of the Mississippi, Rhine and Nile rivers?\n\nMake a plan. Search for each fact you need (one search per fact, in the order the task\nmentions them), then give ONE arithmetic expression that combines the facts, using\n{0}, {1}, ... as placeholders for the numbers found by search 0, search 1, ...\nReply with JSON only, for example:\n{\"steps\": [{\"tool\": \"search\", \"query\": \"height of Mont Blanc\"}, {\"tool\": \"search\", \"query\": \"height of Ben Nevis\"}], \"expression\": \"{0}-{1}\"}\n",
      "output": "{\"steps\": [{\"tool\": \"search\", \"query\": \"length of Mississippi\"}, {\"tool\": \"search\", \"query\": \"length of Rhine\"}, {\"tool\": \"search\", \"query\": \"length of Nile\"}], \"expression\": \"({0}+{1}+{2})/3\"}",
      "depends_on": [],
      "error": null,
      "tokens": 221
    },
    {
      "step_no": 2,
      "actor": "search_agent",
      "kind": "tool_call",
      "input": "length of Mississippi",
      "output": "",
      "depends_on": [
        1
      ],
      "error": null,
      "tokens": 0
    },
    {
      "step_no": 3,
      "actor": "reader",
      "kind": "model_call",
      "input": "### READ\nExtract the single number that answers the question from the text.\nReply with the number only (no units, no words). If there is no number, reply: unknown\n\nQuestion: length of Mississippi\nText: \n",
      "output": "unknown",
      "depends_on": [
        2
      ],
      "error": null,
      "tokens": 51
    },
    {
      "step_no": 4,
      "actor": "search_agent",
      "kind": "tool_call",
      "input": "length of Rhine",
      "output": "The Rhine river is 1230 kilometers long.",
      "depends_on": [
        1
      ],
      "error": null,
      "tokens": 0
    },
    {
      "step_no": 5,
      "actor": "reader",
      "kind": "model_call",
      "input": "### READ\nExtract the single number that answers the question from the text.\nReply with the number only (no units, no words). If there is no number, reply: unknown\n\nQuestion: length of Rhine\nText: The Rhine river is 1230 kilometers long.\n",
      "output": "1230",
      "depends_on": [
        4
      ],
      "error": null,
      "tokens": 60
    },
    {
      "step_no": 6,
      "actor": "search_agent",
      "kind": "tool_call",
      "input": "length of Nile",
      "output": "The Nile river is 6650 kilometers long.",
      "depends_on": [
        1
      ],
      "error": null,
      "tokens": 0
    },
    {
      "step_no": 7,
      "actor": "reader",
      "kind": "model_call",
      "input": "### READ\nExtract the single number that answers the question from the text.\nReply with the number only (no units, no words). If there is no number, reply: unknown\n\nQuestion: length of Nile\nText: The Nile river is 6650 kilometers long.\n",
      "output": "6650",
      "depends_on": [
        6
      ],
      "error": null,
      "tokens": 59
    },
    {
      "step_no": 8,
      "actor": "answerer",
      "kind": "model_call",
      "input": "### ANSWER\nTask: What is the average length in kilometers of the Mississippi, Rhine and Nile rivers?\nCalculation result: unavailable\n\nWrite the final answer as: Final answer: <number>\n",
      "output": "Final answer: unknown",
      "depends_on": [
        3,
        5,
        7
      ],
      "error": null,
      "tokens": 51
    }
  ],
  "task_id": "t22",
  "final_answer": "Final answer: unknown",
  "created_at": "2026-10-03T16:13:57+00:00",
  "fault": {
    "step_no": 2,
    "type": "skipped_step",
    "seed": 9774,
    "applied": true
  }
}