{
  "run_id": "run_0163",
  "framework": "custom",
  "model": "mock-small",
  "task": "What is the combined population of France and Germany in millions?",
  "outcome": "fail",
  "faulty_step": null,
  "steps": [
    {
      "step_no": 1,
      "actor": "planner",
      "kind": "decision",
      "input": "### PLAN\nYou are a research agent with two tools:\n- search(query): looks up one fact, e.g. \"population of France\"\n- calculator(expression): evaluates arithmetic, e.g. \"12.5+3\"\n\nTask: What is the combined population of France and Germany in millions?\n\nMake a plan. Search for each fact you need (one search per fact, in the order the task\nmentions them), then give ONE arithmetic expression that combines the facts, using\n{0}, {1}, ... as placeholders for the numbers found by search 0, search 1, ...\nReply with JSON only, for example:\n{\"steps\": [{\"tool\": \"search\", \"query\": \"height of Mont Blanc\"}, {\"tool\": \"search\", \"query\": \"height of Ben Nevis\"}], \"expression\": \"{0}-{1}\"}\n",
      "output": "{\"steps\": [{\"tool\": \"search\", \"query\": \"population of France\"}, {\"tool\": \"search\", \"query\": \"population of Germany\"}], \"expression\": \"{0}+{1}\"}",
      "depends_on": [],
      "error": null,
      "tokens": 204
    },
    {
      "step_no": 2,
      "actor": "search_agent",
      "kind": "tool_call",
      "input": "population of France",
      "output": "France has a population of 68.2 million people.",
      "depends_on": [
        1
      ],
      "error": null,
      "tokens": 0
    },
    {
      "step_no": 3,
      "actor": "reader",
      "kind": "model_call",
      "input": "### READ\nExtract the single number that answers the question from the text.\nReply with the number only (no units, no words). If there is no number, reply: unknown\n\nQuestion: population of France\nText: France has a population of 68.2 million people.\n",
      "output": "682",
      "depends_on": [
        2
      ],
      "error": null,
      "tokens": 63
    },
    {
      "step_no": 4,
      "actor": "search_agent",
      "kind": "tool_call",
      "input": "population of Germany",
      "output": "Germany has a population of 83.3 million people.",
      "depends_on": [
        1
      ],
      "error": null,
      "tokens": 0
    },
    {
      "step_no": 5,
      "actor": "reader",
      "kind": "model_call",
      "input": "### READ\nExtract the single number that answers the question from the text.\nReply with the number only (no units, no words). If there is no number, reply: unknown\n\nQuestion: population of Germany\nText: Germany has a population of 83.3 million people.\n",
      "output": "83.3",
      "depends_on": [
        4
      ],
      "error": null,
      "tokens": 63
    },
    {
      "step_no": 6,
      "actor": "calculator",
      "kind": "tool_call",
      "input": "682+83.3",
      "output": "765.3",
      "depends_on": [
        1,
        3,
        4,
        5
      ],
      "error": null,
      "tokens": 0
    },
    {
      "step_no": 7,
      "actor": "answerer",
      "kind": "model_call",
      "input": "### ANSWER\nTask: What is the combined population of France and Germany in millions?\nCalculation result: 765.3\n\nWrite the final answer as: Final answer: <number>\n",
      "output": "Final answer: 765.3",
      "depends_on": [
        6
      ],
      "error": null,
      "tokens": 44
    }
  ],
  "task_id": "t03",
  "final_answer": "Final answer: 765.3",
  "created_at": "2026-10-03T16:13:56+00:00"
}