{
  "run_id": "run_0019",
  "framework": "custom",
  "model": "mock-large",
  "task": "What is the combined population of Egypt and Germany in millions?",
  "outcome": "success",
  "faulty_step": null,
  "steps": [
    {
      "step_no": 1,
      "actor": "planner",
      "kind": "decision",
      "input": "### PLAN\nYou are a research agent with two tools:\n- search(query): looks up one fact, e.g. \"population of France\"\n- calculator(expression): evaluates arithmetic, e.g. \"12.5+3\"\n\nTask: What is the combined population of Egypt and Germany in millions?\n\nMake a plan. Search for each fact you need (one search per fact, in the order the task\nmentions them), then give ONE arithmetic expression that combines the facts, using\n{0}, {1}, ... as placeholders for the numbers found by search 0, search 1, ...\nReply with JSON only, for example:\n{\"steps\": [{\"tool\": \"search\", \"query\": \"height of Mont Blanc\"}, {\"tool\": \"search\", \"query\": \"height of Ben Nevis\"}], \"expression\": \"{0}-{1}\"}\n",
      "output": "{\"steps\": [{\"tool\": \"search\", \"query\": \"Egypt total population\"}, {\"tool\": \"search\", \"query\": \"Germany total population\"}], \"expression\": \"{0}+{1}\"}",
      "depends_on": [],
      "error": null,
      "tokens": 206
    },
    {
      "step_no": 2,
      "actor": "search_agent",
      "kind": "tool_call",
      "input": "Egypt total population",
      "output": "Egypt has a population of 112.7 million people.",
      "depends_on": [
        1
      ],
      "error": null,
      "tokens": 0
    },
    {
      "step_no": 3,
      "actor": "reader",
      "kind": "model_call",
      "input": "### READ\nExtract the single number that answers the question from the text.\nReply with the number only (no units, no words). If there is no number, reply: unknown\n\nQuestion: Egypt total population\nText: Egypt has a population of 112.7 million people.\n",
      "output": "112.7",
      "depends_on": [
        2
      ],
      "error": null,
      "tokens": 63
    },
    {
      "step_no": 4,
      "actor": "search_agent",
      "kind": "tool_call",
      "input": "Germany total population",
      "output": "Germany has a population of 83.3 million people.",
      "depends_on": [
        1
      ],
      "error": null,
      "tokens": 0
    },
    {
      "step_no": 5,
      "actor": "reader",
      "kind": "model_call",
      "input": "### READ\nExtract the single number that answers the question from the text.\nReply with the number only (no units, no words). If there is no number, reply: unknown\n\nQuestion: Germany total population\nText: Germany has a population of 83.3 million people.\n",
      "output": "83.3",
      "depends_on": [
        4
      ],
      "error": null,
      "tokens": 64
    },
    {
      "step_no": 6,
      "actor": "calculator",
      "kind": "tool_call",
      "input": "112.7+83.3",
      "output": "196",
      "depends_on": [
        1,
        2,
        3,
        4,
        5
      ],
      "error": null,
      "tokens": 0
    },
    {
      "step_no": 7,
      "actor": "answerer",
      "kind": "model_call",
      "input": "### ANSWER\nTask: What is the combined population of Egypt and Germany in millions?\nCalculation result: 196\n\nWrite the final answer as: Final answer: <number>\n",
      "output": "Final answer: 196",
      "depends_on": [
        6
      ],
      "error": null,
      "tokens": 43
    }
  ],
  "task_id": "t04",
  "final_answer": "Final answer: 196",
  "created_at": "2026-10-03T16:13:55+00:00"
}